Dal je spet izkopati vodnjake, ki so jih izkopali v dneh njegovega očeta Abrahama, pa so jih Filistejci po Abrahamovi smrti zasuli. Dal jim je tista imena, s katerimi jih je poimenoval njegov oče.	In zopet izkoplje Izak vodnjake, ki so jih bili izkopali v dnevih Abrahama, očeta njegovega. Kajti Filistejci so jih bili ustavili po smrti Abrahamovi. In imenoval je njih imena po imenih, po katerih jih je imenoval oče njegov.
Izakovi hlapci so kopali v dolini in tam našli vodnjak žive vode.	Izakovi služabniki so kopali v dolini in tam našli vodnjak izvirajoče vode.
"Gerárski pastirji pa so se začeli prepirati z Izakovimi pastirji in rekli: ""Voda je naša."" Zato je Izak studenec imenoval Esek,  ker so se z njim prepirali."	"Gerarski pastirji so se prepirali z Izakovimi pastirji in govorili: ""Voda je naša."" Imenoval je vodnjak Esek, ker so se prepirali z njim."
Izkopali so še drug vodnjak. Pa tudi zaradi tega so se sprli. Zato mu je dal ime Sitna.	So izkopali še en vodnjak, in so trdili, da je, prav tako. Ime je Sitnah.
"Premaknil se je od tam in izkopal drug vodnjak, zanj pa se niso prepirali; zato mu je dal ime Rehobót.  Rekel je: ""Resnično, zdaj nam je Gospod razširil prostor, da lahko rastemo v deželi."""	"Zapustil je tisti kraj in izkopal drug vodnjak. O njem se niso prepirali. Imenoval ga je Rehobot. Rekel je: ""Za zdaj nam je GOSPOD naredil prostor, in rodovitni bomo v deželi."""
"Gospod se mu je prikazal tisto noč in rekel: ""Jaz sem Bog tvojega očeta Abrahama. Nikar se ne boj, kajti jaz sem s teboj! Blagoslovil te bom in pomnožil tvoje potomstvo zaradi svojega služabnika Abrahama."""	In GOSPOD se mu prikaže tisto noč in reče: Jaz sem Bog Abrahama, očeta tvojega. Ne boj se, ker jaz sem s teboj in te blagoslovim in pomnožim seme tvoje zaradi hlapca svojega Abrahama.
Tam je Izak postavil oltar in klical Gospodovo ime. Razpel je svoj šotor in Izakovi hlapci so tam izkopali vodnjak.	Tam je sezidal oltar in klical ime GOSPODOVO in postavil ondi šator svoj. In tam so kopali vodnjaka hlapci Izakovi.
Tedaj je prišel k njemu Abiméleh iz Gerárja. Z njim sta bila še njegov svetovalec Ahuzát in poveljnik vojske Pihól.	Nato je šel Abimelek k njemu iz Gerara in njegov prijatelj Ahuzat in poveljnik njegove vojske Pikol.
"Izak jim je rekel: ""Čemu ste prišli k meni, ko me sovražite in ste me pregnali od sebe?"""	"In Izak jim reče: ""Zakaj ste prišli k meni, ko pa me sovražite in ste me odslovili od sebe?"""
"Rekli so: ""Jasno smo videli, da je Gospod s teboj in smo rekli: ›Dogovorimo se med seboj, mi in ti!‹ Radi bi sklenili zavezo s teboj,"	"Rekli so: ""Jasno smo videli, da je GOSPOD s teboj, in rekli smo: Bodi torej prisega med nami in teboj, in sklenimo zavezo s teboj!"
"da nam ne storiš nič hudega, kakor se te mi nismo dotaknili in kakor smo ti storili le dobro in te odpustili v miru. Zdaj je tebe Gospod blagoslovil."""	"da nam ne boš storil nič hudega, kakor se te nismo dotaknili in kakor smo ti storili samo dobro in smo te v miru poslali proč. ""Zdaj si blagoslovljen od GOSPODA."""
Zjutraj so zgodaj vstali in si prisegli med seboj. Potem jih je Izak odpustil in odšli so v miru.	In vstali so nekaj časa zjutraj in prisegli drug drugemu. Izak jih je odslovil, in odšli so od njega v miru.
"Prav tistega dne so prišli Izakovi hlapci in mu povedali o vodnjaku, ki so ga kopali. Rekli so: ""Našli smo vodo."""	"Zgodilo se je istega dne, ko so prišli Izakovi služabniki in mu povedali o vodnjaku, ki so ga izkopali, ter mu rekli: ""Našli smo vodo."""
Dal mu je ime Šiba.  Zato se mesto imenuje Beeršéba  do današnjega dne.	In imenoval ga je Šiba; zato je ime tega mesta Berseba do današnjega dne.
Ko je bil Ezav star štirideset let, je vzel za ženo Jehudíto, hčer Hetejca Beeríja, in Basemáto, hčer Hetejca Elóna.	Ko je bil Ezav star štirideset let, si je vzel za ženo Judito, hčer Hetejca Beera, in Basemato, hčer Elona Hetejca.
"Izak se je postaral in oči so mu opešale, da ni mogel videti. Poklical je starejšega sina Ezava in mu rekel: ""Moj sin!"" Ta mu je rekel: ""Tukaj sem."""	"To se je zgodilo, da je, ko je bil Isaac stara, in njegove oči so bile dim, tako da ni mogel videti, je poklical Ezav svojega starejšega sina, in mu rekel,, ""Moj sin?"" On mu je rekel,, ""Tukaj sem."""
"Rekel je: ""Glej, postaral sem se in ne vem, kdaj pride dan moje smrti."	"Rekel mi je: ""Poglej, jaz sem star, ne vem, kdaj bo dan moje smrti."
Vzemi zdaj svojo pripravo, tulec in lok, pojdi na polje in ulôvi zame kako divjad!	Zdaj torej, prosim vzemite svoje orožje, vaš tul in svoj lok, in pojdite ven na področju, in vzemi mi divjačino.
"Potem mi pripravi okusno jed, kakršno imam rad, in mi jo prinesi, da bom jedel. Zato, da te moja duša blagoslovi, preden umrem."""	"Pripravi mi okusno hrano, takšno, kakršno ljubim, in mi jo prinesi, da bom lahko jedel in da te bo moja duša blagoslovila, preden umrem. """
Rebeka pa je poslušala, kaj je Izak govoril sinu Ezavu. Ezav je odšel na polje, da bi ulovil in prinesel plen.	"Rebeka je slišala, ko je Izak govoril svojemu sinu Ezavu: ""Ezav je šel na polje lovit divjačino in jo prinašat""."
"Rebeka pa je rekla sinu Jakobu: ""Slišala sem, kaj je oče govoril tvojemu bratu Ezavu. Rekel je:"	"Rebeka je govorila svojemu sinu Jakobu in rekla: ""Glej, slišala sem očeta tvojega govoriti s tvojim bratom Ezavom, rekoč:"
›Prinesi mi plen in mi pripravi okusno jed, da bom jedel in te blagoslovil pred Gospodom, preden umrem.‹	Prinesi mi divjačino in pripravi mi okusno jed, da jo bom jedel in te blagoslovil pred GOSPODOM, preden umrem.
Zdaj pa, moj sin, poslušaj moj glas, kaj ti zapovem!	Zdaj torej, moj sin, poslušati moj glas v skladu s tem, kar sem ti ukaz.
Pojdi k čredi in vzemi od tam dva lepa kozlička, da ju pripravim za okusno jed, kakršno ima tvoj oče rad!	Pojdi zdaj na čredo, in mi je od tam dve dobri kozlički. Bom jim okusno hrano za tvojega očeta, kot je on ljubi.
"Potem jo boš odnesel očetu, da bo jedel in te blagoslovil, preden umre."""	"Prinesi ga svojemu očetu, da bo lahko jedel, tako da te bo lahko blagoslovil pred svojo smrtjo. """
"Jakob je rekel materi Rebeki: ""Glej, moj brat Ezav je kosmat človek, jaz pa sem gladek."	"Jakob je rekel Rebeki, svoji materi: ""glej, moj brat Ezav je kosmat mož, in jaz sem gladek mož."
"Morda me oče potipa. Menil bo, da se norčujem iz njega, in namesto blagoslova si bom nakopal prekletstvo."""	"Kaj pa, če bi se me dotaknil moj oče? Zdel se mu bom kakor slepar in bi nad sebe prinesel prekletstvo, ne pa blagoslova. """
"Mati mu je rekla: ""Tvoje prekletstvo naj pride name, moj sin! Le poslušaj moj glas, pojdi in mi prinesi!"""	"Njegova mati mu je rekla: ""Naj pride prekletstvo tvoje nadme, sin moj, samo poslušaj moj glas in pojdi in mi jih prinesi."""
Šel je, vzel in prinesel materi. In mati je pripravila okusno jed, kakršno je imel oče rad.	Šel je, in jih dobil, in jih prinesel k svoji materi. Njegova mati je okusno hrano, kot je njegov oče ljubil.
Nato je Rebeka vzela najboljšo obleko svojega starejšega sina Ezava, ki jo je imela pri sebi v hiši, in jo nadela svojemu mlajšemu sinu Jakobu.	Rebeka je vzela dobro obleko svojega starejšega sina Ezava, ki je bila z njo v hiši, in jo nadela svojemu mlajšemu sinu Jakobu.
Koži kozličkov pa mu je ovila okoli rok in okoli gladkega vratu.	Kože kozjih mladičev je položila na njegove roke in jih položila na gladko površino njegovega vratu.
In dala je okusno jed in kruh, ki ga je pripravila, v roke svojemu sinu Jakobu.	Okusno jed in kruh, ki ju je pripravila, je dala v roke svojemu sinu Jakobu.
"Ko je prišel k očetu, je rekel: ""Moj oče!"" Ta je rekel: ""Tukaj sem. Kdo si ti, moj sin?"""	"Prišel je k svojemu očetu in rekel: ""Oče moj!"" Rekel je: ""Tukaj sem, kdo si ti, sin moj?"""
"Jakob je rekel očetu: ""Ezav sem, tvoj prvorojenec. Storil sem, kakor si mi ukazal. Vstani, sédi in jej od mojega plena, da me tvoja duša blagoslovi!"""	Jakob pa reče očetu svojemu: Jaz sem Ezav, prvenec tvoj. Storil sem, kar si me prosil. vstani, sedi in jej od lova mojega, da me blagoslovi duša tvoja.
"Izak je rekel sinu: ""Kako to, da si ga našel tako hitro, moj sin?"" Pa je rekel: ""Gospod mi ga je poslal naproti."""	"In Izak reče sinu svojemu: ""Kako to, da si to našel tako hitro, sin moj?"" Rekel je: ""Ker mi je GOSPOD, tvoj Bog, dal uspeh."""
"Izak je rekel Jakobu: ""Stopi bliže, da te potipam, moj sin, ali si ti moj sin Ezav ali ne!"""	"Izak je rekel Jakobu: ""Pristopi, prosim, da te občutim, sin moj, če si res moj sin Ezav ali ne."""
"Jakob se je približal očetu Izaku in ta ga je potipal in rekel: ""Glas je Jakobov glas, toda roki sta Ezavovi roki."""	"In Jakob se približa očetu svojemu Izaku, ki ga je otipal in rekel: ""Glas je glas Jakobov, roke pa so Ezavove."""
Tako ga ni spoznal, ker je imel roki poraščeni kakor njegov brat Ezav. Potem ga je blagoslovil.	ni ga prepoznal, ker so bile njegove roke kosmate, tako kot Ezavove roke njegovega brata, zato ga je blagoslovil.
"Rekel je: ""Si ti moj sin Ezav?"" Rekel je: ""Sem."""	"Rekel je: ""Si res moj sin Ezav?"" Rekel je: ""Jaz sem."""
"Potem je rekel: ""Daj mi bliže, da bom jedel od plena svojega sina in te moja duša blagoslovi!"" Postavil je jed predenj in on je jedel. Prinesel mu je vina in je pil."	"Rekel je,, ""Približajte se mi, in bom jedel od lova mojega sina, tako da lahko moja duša vas blagoslovi. ""On ga je prinesel blizu k njemu, in je jedel. Prinesel mu je vino, in je pil."
"Potem mu je oče Izak rekel: ""Stopi sem in me poljubi, moj sin!"""	"Njegov oče Izak mu je rekel: ""Približaj se zdaj in poljubi mene, mojega sina."""
"Stopil je k njemu in ga poljubil. Tedaj je začutil vonj njegove obleke. Blagoslovil ga je, rekoč: ""Glej, vonj mojega sina je kakor vonj polja, ki ga Gospod blagoslavlja."	"Pristopil je k njemu in ga poljubil. Zavohal je vonj njegovega oblačila in ga blagoslovil. Rekel je: ""Glej, vonj mojega sina je kakor vonj polja, ki ga je blagoslovil Jehova."
Bog ti daj rose neba in rodovitno zemljo in obilico žita in vina!	bog ti je dal roso z neba, maščobo zemlje, pa tudi obilje žita in svežega vina.
"Naj ti služijo ljudstva in se ti priklanjajo rodovi! Zagospoduj svojim bratom in priklanjajo naj se ti sinovi tvoje matere! Preklet naj bo, kdor te preklinja, in blagoslovljen, kdor te blagoslavlja!"""	"Naj ti služijo ljudstva, klanjajo naj se ti narodi, bodi gospodar svojim bratom, klanjajo naj se ti sinovi tvoje matere, vsak, ki te preklinja, bodi preklet, vsak, ki te blagoslavlja, bodi blagoslovljen. """
Ko pa je Izak sklenil svoj blagoslov nad Jakobom in je Jakob komaj odšel izpred obličja očeta Izaka, se je njegov brat Ezav vrnil z lova.	Takoj ko je Izak prenehal blagoslavljati Jakoba in je Jakob ravno odšel iz navzočnosti svojega očeta Izaka, se je njegov brat Ezav vrnil z lova.
"Tudi on je pripravil okusno jed in jo prinesel očetu. Rekel je: ""Vstani, moj oče, in jej od plena svojega sina, da me tvoja duša blagoslovi!"""	"Tudi on je pripravil okusno jed in jo prinesel očetu svojemu, ter rekel očetu svojemu: ""Vstani oče moj in jej od lova sina svojega, da me blagoslovi duša tvoja."""
"Oče Izak pa mu je rekel: ""Kdo si?"" Rekel je: ""Tvoj prvorojeni sin Ezav sem."""	"njegov oče Izak mu je rekel:, ""Kdo si ti?"" Rekel je, ""Jaz sem tvoj sin, tvoj prvorojenec, Ezav."""
"Izak se je tedaj na moč prestrašil in rekel: ""Kdo pa je potem oni, ki mi je ulovil in prinesel plen, da sem jedel od vsega, preden si prišel ti? Blagoslovil sem ga in ostal bo blagoslovljen!"""	"Izak je silovito vztrepetal in rekel: ""kdo je potem tisti, ki je vzel divjačino in mi jo prinesel, in jedel sem vse, preden ste prišli, in ga blagoslovil? da, blagoslovljen bo."""
"Ko je Ezav slišal očetove besede, je glasno in bridko zajokal in rekel očetu: ""Blagoslovi tudi mene, oče!"""	"Ko je Ezav slišal očetove besede, je zajokal s silno velikim in bridkim vpitjem ter rekel očetu: ""Blagoslovi me, tudi mene, mojega očeta."""
"Rekel je: ""Tvoj brat je prišel s prevaro in vzel tvoj blagoslov."""	"Rekel je: ""Tvoj brat je prišel s prevaro in ti odvzel blagoslov."""
"Ezav je rekel: ""Mar mu je zato ime Jakob,  ker me je dvakrat ogoljufal? Vzel mi je pravico prvorojenstva, zdaj pa mi je vzel še blagoslov."" Rekel je: ""Ali nisi prihranil nobenega blagoslova zame?"""	"On je rekel, ""Ali ni bil pravilno imenovan Jacob? Za me je izpodrinila ti dve krat. Vzel mi je rojstno pravico. Glej, zdaj je vzel moj blagoslov."" On je rekel,, ""Ali nisi rezerviran blagoslov za mene?"""
"Izak je odgovoril in rekel Ezavu: ""Glej, za gospodarja sem ga postavil tebi in vse njegove brate sem mu dal za služabnike. Z žitom in vinom sem ga oskrbel; kaj pa naj storim zate, moj sin?"""	"In Izak odgovori Ezavu: Glej, postavil sem ga za gospoda tvojega in dal sem mu za hlapce vse brate njegove. Z žitom in novim vinom sem ga oskrboval. Kaj naj torej storim zate, sin moj? """
"Ezav je rekel očetu: ""Ali imaš samo en blagoslov, moj oče? Blagoslovi tudi mene, oče!"" Ezav je glasno zajokal."	"Ezav je rekel očetu svojemu: ""Ali imaš le en blagoslov, oče moj, in blagoslovi mene, in tudi mene, očeta mojega."" Ezav je povzdignil glas svoj in zajokal."
"Oče Izak je odgovoril in mu rekel: ""Glej, daleč od plodne zemlje bo tvoje bivališče in daleč od rose neba od zgoraj."	"njegov oče Izak mu je odgovoril: ""glej, v obilju zemlje ti bodi prebivališče, v rosi neba od zgoraj."
"Z mečem se boš preživljal in bratu boš služil; ko pa se boš stresel, boš zlomil njegov jarem z vratu."""	"Od meča svojega boš živel in služil boš bratu svojemu, in zgodilo se bo, ko boš popustil, da boš stresel jarem njegov z vratu svojega. """
"Ezav je zasovražil Jakoba zaradi blagoslova, s katerim ga je blagoslovil njegov oče. Sam pri sebi je govoril: ""Bližajo se dnevi žalovanja za očetom; potem brata Jakoba ubijem."""	"Ezav je sovražil Jakoba zaradi blagoslova, s katerim ga je blagoslovil oče njegov. V srcu svojem je rekel: ""Bližajo se dnevi žalovanja za očetom mojim, tedaj umorim brata svojega Jakoba."""
"Rebeki so sporočili besede starejšega sina Ezava. Dala je poklicati mlajšega sina Jakoba in mu rekla: ""Glej, tvoj brat Ezav se hoče maščevati nad teboj in te ubiti."	"Ko so Rebeki sporočili besede Ezava, njenega starejšega sina, je poslala in poklicala Jakoba, svojega mlajšega sina, in mu rekla: ""Glej, tvoj brat Ezav se tolaži s tem, da te namerava umoriti."
Zdaj pa, moj sin, poslušaj moj glas! Odpravi se in zbéži k mojemu bratu Labánu v Harán!	Zdaj torej, moj sin, ubogati moj glas. Vstani, pobegniti k Labanu, moj brat, v Haran.
Ostani pri njem nekaj časa, dokler se bratov srd ne poleže,	Ostani z njim nekaj dni, dokler se ne odvrne srd tvojega brata.
"dokler se njegova jeza do tebe ne odvrne od tebe in ne pozabi, kaj si mu storil. Tedaj bom poslala pote in te vzela od tam. Zakaj naj bi vaju oba izgubila isti dan?"""	"dokler se jeza tvojega brata ne odvrne od tebe in pozabi, kaj si mu storila. Potem pošljem in te dobim od tam. Zakaj bi se jaz jalovenil obeh v enem dnevu? """
"Rebeka je rekla Izaku: ""Zaradi Hetovih hčera mi je zoprno živeti. Če si še Jakob vzame za ženo katero izmed Hetovih hčera, kakor sta oni dve, izmed hčera te dežele, čemu naj še živim?"""	"Rebeka je rekla Izaku: ""Naveličan sem življenja svojega zaradi Hetovih hčera. Če si Jakob vzame ženo izmed Hetovih hčera, kakor so te, izmed hčera dežele, kaj dobrega mi bo storilo življenje?"""
"Izak je tedaj poklical Jakoba, ga blagoslovil in mu zapovedal: ""Ne jemlji si žene izmed Kánaanovih hčera!"	"Izak je poklical Jakoba, ga blagoslovil in mu zapovedal: ""ne jemlji si žene izmed hčera Kanaancev."
Odpravi se na pot in pojdi v Mezopotamijo, v hišo Betuéla, očeta tvoje matere, in od tam si vzemi ženo, izmed hčera materinega brata Labána!	Vstani, pojdi v Padan Aram, v hišo Betuela, očeta svoje matere, in vzemi od tam ženo izmed hčera Labana, brata svoje matere.
Bog Mogočni naj te blagoslovi, naj te stori rodovitnega in te namnoži, da bo iz tebe nastalo občestvo ljudstev!	Naj te vsemogočni Bog blagoslovi in te napravi rodovitnega in te pomnoži, da boš postala družba ljudstev.
"Naj ti dá Abrahamov blagoslov, tebi in tvojim potomcem za teboj, da vzameš v last deželo svojega tujčevanja, ki jo je Bog dal Abrahamu!"""	"in vam dal blagoslov Abrahama, za vas in za vaše seme z vami, tako da lahko podedujejo deželo, kjer potujete, ki je Bog dal Abrahamu. """
Tako je Izak poslal Jakoba od doma. In šel je v Mezopotamijo k Labánu, sinu Aramejca Betuéla, bratu Jakobove in Ezavove matere Rebeke.	Izak je poslal Jakoba in je šel v Padan Aram k Labanu, sinu Betuela Sirijca, Rebekinega brata, Jakobove in Ezavove matere
"Ezav je izvedel, kako je Izak blagoslovil Jakoba in ga odposlal v Mezopotamijo, da bi si od tam vzel ženo, in kako mu je pri blagoslovu zapovedal in rekel: ""Ne jemlji si žene izmed kánaanskih hčera!"""	"Ezav pa je videl, da je Izak blagoslovil Jakoba in ga poslal v Padan-aram, da bi si od tam vzel ženo, in ko ga je blagoslavljal, mu je zapovedal, rekoč: ""Ne jemlji si žene izmed hčera Kanaancev,"""
In še, da je Jakob poslušal očeta in mater ter odšel v Mezopotamijo.	in da je Jakob ubogal očeta svojega in mater svojo in odšel v Padan-aram.
Tako je Ezav spoznal, da njegov oče ne vidi rad kánaanskih hčera.	Ezav je videl, da Kanaanove hčere niso po volji Izaku, njegovemu očetu.
Šel je torej k Izmaelu in si vzel k svojima ženama za ženo še Mahaláto, hčer Abrahamovega sina Izmaela, Nebajótovo sestro.	Ezav je šel k Izmaelu in si poleg žena, ki jih je imel, za ženo vzel Mahalato, hčer Izmaela, Abrahamovega sina, sestro Nebajota.
Dospel je do nekega kraja, in ker je sonce že zašlo, je tam prenočil. Vzel je enega od kamnov tistega kraja, si ga položil za vzglavje in zaspal na tistem mestu.	Prišel je na določenem mestu, in ostal tam vso noč, ker je sonce zašlo. Vzel je eno od kamnov v kraju, in ga dal pod glavo, in določijo na tem mestu za spanje.
V sanjah so se mu prikazale stopnice,  ki so bile postavljene na zemljo, vrh pa jim je segal do neba. In po njih so Božji angeli hodili gor in dol.	Sanjal je: glej, na zemlji je bilo postavljeno stopnišče in njegov vrh je segal do nebes, in glej, Božji angeli so se vzpenjali in spuščali po njem.
"In glej, Gospod je stal zgoraj in rekel: ""Jaz sem Gospod, Bog tvojega očeta Abrahama in Izakov Bog. Zemljo, na kateri ležiš, bom dal tebi in tvojim potomcem."	In glej, GOSPOD je stal nad njo in govoril: Jaz sem GOSPOD, Bog Abrahama, očeta tvojega, in Bog Izakov: deželo, na kateri ležiš, ti bom dal, in semenu tvojemu.
Tvojih potomcev bo kakor prahu zemlje. Razširil se boš proti zahodu in vzhodu, proti severu in jugu, in v tebi in tvojem potomstvu bodo blagoslovljeni  vsi rodovi zemlje.	Seme tvoje bo kakor prah zemlje, in ti se bo razširil v tujini na zahod, in na vzhodu, in na severu, in na jugu. V tebi in v tvojem semenu bodo blagoslovljeni vsi rodovi na zemlji.
"Glej, jaz bom s teboj in varoval te bom, kjer koli boš hodil, in pripeljal te bom nazaj v to deželo. Zares te ne bom zapustil, dokler ne storim, kar sem ti obljubil."""	"Glej, jaz sem z vami, in vas bo vodila, kamorkoli greste, in vas bo spet prinesel v to deželo. Za ne bom pustil, dokler sem naredil, kar sem govoril z vami. """
"Ko se je Jakob prebudil, je rekel: ""Zares, Gospod je na tem kraju, pa nisem vedel."""	"Jakob se je prebudil iz spanja in rekel: ""zagotovo je Jehova na tem kraju, jaz pa tega nisem vedel."""
"Prevzel ga je strah in je rekel: ""Kako strah vzbujajoč je ta kraj! To ni nič drugega kakor hiša Božja in vrata nebeška!"""	"Bal se je in je rekel: ""Kako strašen je ta kraj, to ni nihče drug kot božja hiša in to so nebeška vrata."""
Zjutraj je Jakob zgodaj vstal, vzel kamen, ki ga je imel za vzglavje, in ga postavil za spomenik ter na vrh izlil olje.	Jakob je zjutraj zgodaj vstal in vzel kamen, ki si ga je bil položil pod glavo, in ga postavil v steber ter na vrh izlil olje.
Ta kraj je imenoval Betel,  prej pa se je mesto imenovalo Luz.	Ime tega kraja je imenoval Betel, toda sprva se je to mesto imenovalo Luz.
"Potem se je Jakob zaobljubil in rekel: ""Če bo Bog z menoj in me bo varoval na poti, po kateri hodim, če mi bo dajal kruha, da ga bom jedel, in obleko, da se bom oblačil,"	"Jacob prisegel zaobljubo, rekoč, ""Če bo Bog z menoj, in me bo na ta način, da grem, in mi bo dal kruha jesti, in oblačila, da dajo na,"
in če se bom srečno vrnil v očetovo hišo, bo Gospod moj Bog.	tako da se bom v miru vrnil v hišo svojega očeta, in GOSPOD bo moj Bog,
"Ta kamen pa, ki sem ga postavil za spomenik, bo Božja hiša. In od vsega, kar mi boš dal, ti bom zagotovo dajal desetino."""	"potem bo ta kamen, ki sem ga postavil kot steber, postal hiša božja. od vsega, kar mi daste, vam bom desetino gotovo dal. """
Jakob je vzdignil svoje noge in šel v deželo sinov vzhoda.	Nato se je Jakob odpravil na pot in prišel v deželo vzhodnih sinov.
Pogledal je in zagledal vodnjak na polju. Pri njem so počivale tri črede drobnice, kajti iz tega vodnjaka so napajali črede. Odprtina pri vodnjaku pa je bila pokrita z velikim kamnom.	Pogledal je, in glej, vodnjak na področju, in, Evo, tri črede ovac, ki leži tam z njim. Za iz tega vodnjaka so zalivali črede. Kamen na dobro usta je bila velika.
Kadar so se tam zbrale vse črede, so ga odvalili in napojili drobnico. Nato pa so kamen spet zavalili na njegovo mesto nad odprtino.	Tam so bile zbrane vse črede. Odvalili so kamen iz vodnjakovih ust in zalivali ovce ter kamen spet položili na studenec na njegovem mestu.
"Jakob jim je rekel: ""Bratje, od kod ste?"" Rekli so: ""Iz Harána smo."""	"Jakob jim je rekel: ""sorodniki moji, od kod ste?"" Rekli so: ""mi smo iz Harana."""
"Rekel jim je: ""Ali poznate Labána, Nahórjevega sina?"" Rekli so: ""Poznamo."""	"Rekel jim je: ""Ali poznate Labana, Nahorjevega sina?"" Rekli so: ""Mi ga poznamo."""
"Rekel jim je: ""Ali se mu dobro godi?"" Rekli so: ""Dobro. Glej, njegova hči Rahela prihaja z drobnico."""	"Rekel jim je: ""Se mu dobro godi?"" Rekli so: ""Dobro je. Glejte, Rahela, hči njegova, gre z ovcami."""
"Rekel je: ""Poglejte, dan je še dolg, ni še čas, da bi zbrali živino; napojite drobnico in pojdite past!"""	"Rekel je: ""Glejte, še vedno je sredi dneva, ni čas za zbiranje živine skupaj. Zalijte ovce, in pojdite in jih nahranite."""
"Pa so rekli: ""Ne moremo, dokler se ne zberejo vse črede. Potem odvalijo kamen z odprtine vodnjaka in napojimo drobnico."""	"rekli so: ""ne moremo, dokler se vse črede ne zberejo skupaj in odvalijo kamen iz vodnjakovih ust, nato pa napojimo ovce."""
Ko je še govoril z njimi, je prišla Rahela z drobnico svojega očeta; bila je namreč pastirica.	Ko je še govoril z njimi, je prišla Rahela z ovcami svojega očeta, ker jih je čuvala.
Ko je Jakob videl Rahelo, hčer materinega brata Labána, in drobnico materinega brata Labána, je pristopil in odvalil kamen z odprtine vodnjaka in napojil drobnico materinega brata Labána.	To se je zgodilo, ko je Jakob videl Rahelo, hči Laban, mati brata njegova, in ovce Laban, mati je brat njegova, da je Jakob je prišel blizu, in valjanih kamen iz vodnjaka usta, in zalivati čredo Laban, njegova mati je brat.
In Jakob je povedal Raheli, da je brat  njenega očeta in Rebekin sin. Tekla je to povedat očetu.	Jakob je povedal Raheli, da je brat njenega očeta in da je Rebekin sin. - Tekla je in povedala očetu.
Ko je Labán slišal sporočilo o sestrinem sinu Jakobu, mu je tekel naproti, ga objel in poljubil ter ga popeljal v svojo hišo. Potem je Labánu povedal vse, kar se je zgodilo.	To se je zgodilo, ko Laban slišal novico o Jakobu, sin njegove sestre, da je tekel, da izpolnjujejo Jakoba, in ga objel, in ga poljubil, in ga pripeljal v svojo hišo.Jakob je povedal Labanu vse te
"Labán mu je rekel: ""Zares si moja kost in moje meso!"" In Jakob je ostal pri njem mesec dni."	Laban pa mu reče: Gotovo si ti kost moja in meso moje. In živel je z njim mesec dni.
"Potem je Labán rekel Jakobu: ""Mar mi boš zato, ker si moj brat, zastonj služil? Povej mi, kakšno plačilo hočeš!"""	"Laban je rekel Jakobu: ""Ker si moj brat, bi mi torej moral zastonj služiti? Povej mi, kakšen bo tvoj zaslužek?"""
Labán pa je imel dve hčeri: starejši je bilo ime Lea, mlajši pa Rahela.	Laban je imel dve hčeri: starejši se je imenoval Leja, mlajši pa Rahela.
Leine oči so bile motne, Rahela pa je imela lepo postavo in lep obraz.	Leahine oči so bile šibke, Rachel pa je bila lepa in priljubljena.
"Ker je Jakob ljubil Rahelo, je rekel Labánu: ""Služil ti bom sedem let za tvojo mlajšo hčer Rahelo."""	"Jakob je ljubil Rahelo in rekel: ""služil ti bom sedem let za Rahelo, tvojo mlajšo hčer."""
"Labán je rekel: ""Boljše je, da jo dam tebi, kakor da bi jo dal komu drugemu. Ostani pri meni!"""	"Laban je rekel: ""Bolje je, da jo dam tebi, kot da jo dam drugemu moškemu; ostani z menoj."""
Jakob je služil za Rahelo sedem let, toda ker jo je ljubil, so se mu zdela kakor nekaj dni.	Jakob je služil za Rahelo sedem let, in zdela so se mu le nekaj dni, zaradi ljubezni, ki jo je imel do nje.
"Tedaj je rekel Labánu: ""Daj mi mojo ženo, da grem k njej! Kajti čas je potekel."""	"Jakob je rekel Labanu: ""daj mi ženo mojo, ker so izpolnjeni moji dnevi, da grem k njej."""
Labán je zbral vse može iz kraja in napravil svatbo.	Laban je zbral vse može v tistem kraju in pripravil pojedino.
