"Tisti dan je Gospod sklenil z Abramom zavezo in rekel: ""Tvojemu potomstvu dajem to deželo od Egiptovske reke do vélike reke, reke Evfrata;"	Tisti dan je GOSPOD sklenil zavezo z Abramom, rekoč: Semenu tvojemu sem dal to deželo, od reke Egiptovske do reke Velike, reke Evfrat.
Žena Sarája Abramu ni rodila otrok; imela pa je egiptovsko deklo, ki ji je bilo ime Hagára.	Abramova žena Saraja pa mu ni rodila otrok, temveč je imela Egipčanko, ki ji je bilo ime Hagar.
"Sarája je rekla Abramu: ""Glej, Gospod mi ni dal, da bi rodila. Pojdi k moji dekli! Mogoče bom po njej dobila otroka."" Abram je poslušal Sarájo."	"Saraja je rekla Abramu: ""Glej, GOSPOD mi je prepovedal spočeti; pojdi, prosim, k moji služabnici; morda si bom po njej pridobil otroke."" Abram je uslišal glas Sarajev."
Potem ko je preteklo deset let, odkar se je Abram naselil v kánaanski deželi, je Abramova žena Sarája vzela svojo egiptovsko deklo Hagáro in jo dala možu Abramu za ženo.	Saraja, Abramova žena, je vzela Agaro Egipčanko, svojo deklo, potem ko je Abram deset let živel v kanaanski deželi, in jo dala Abramu, svojemu možu, za njegovo ženo.
Šel je k Hagári in je spočela. Ko pa je videla, da je spočela, je začela zaničevati gospodarico.	Šel je v Hagar, in je spočela.Ko je videla, da je bila spočeta, je bila njena ljubica prezirali v njenih očeh.
"Sarája je rekla Abramu: ""Ti si kriv, da me žali. Dala sem ti svojo deklo v naročje, ko pa je videla, da je spočela, me je začela zaničevati. Naj Gospod sodi med menoj in teboj!"""	In Saraja reče Abramu: Krivda tvoja je ta, in dal sem dekle svojo v naročje tvoje, in ko je videla, da je spočela, sem bil zaničevan v očeh njenih. GOSPOD je sodnik med menoj in teboj.
"Abram je rekel Saráji: ""Glej, tvoja dekla je v tvoji roki; naredi z njo, kar se ti zdi prav!"" Tedaj je začela Sarája z njo tako trdo ravnati, da je Hagára pobegnila od nje."	"Abram pa reče Saraju: Glej, dekla tvoja je v roki tvoji, stóri ji, kar je dobro v očeh tvojih. ""In Saraj je hudo ravnala z njo, in pobegnila je izpred obličja njenega."
Gospodov angel jo je našel pri studencu v puščavi, pri izviru ob poti proti Šuru.	Jehovov angel jo je našel pri studencu vode v puščavi, poleg studenca na poti, ki je vodila v Šur.
"Rekel je: ""Hagára, Sarájina dekla, od kod prihajaš in kam greš?"" Rekla je: ""Bežim od svoje gospodarice Saráje."""	"Rekel mi je: ""Hagar, Sarajina dekla, od kod si prišla, kam greš, je rekla,"" Bežim pred obrazom svoje gospodarice Saraje. """
"Gospodov angel ji je rekel: ""Vrni se k svoji gospodarici in se podrêdi njeni roki!"""	"Angel GOSPODOV pa ji je rekel: ""Vrni se k svoji gospodarici in se podvrzi njeni roki."""
"Potem ji je Gospodov angel rekel: ""Silno bom namnožil tvoje potomstvo, da ga ne bo mogoče prešteti."""	"Angel GOSPODOV pa ji reče: Zelo namnožil bom seme tvoje, da ne bo prešteto zaradi množine. """
"In Gospodov angel ji je rekel: ""Glej, spočela si in rodila boš sina; daj mu ime Izmael,  kajti Gospod te je slišal v tvoji stiski."	In angel GOSPODOV ji reče: Glej, noseča si in rodila boš sina; in ime njegovo boš imenovala Izmael, ker GOSPOD je slišal tvojo nesrečo.In GOSPOD je storil, kar je treba.
"Ta človek bo pravi divji osel. Njegova roka bo proti vsem in roke vseh proti njemu; nasproti vsem svojim bratom se bo naselil."""	"In bode kakor divji osel med ljudmi; roka njegova bode zoper vsakega človeka in roke vseh zoper njega; in živel bo nasproti vsem bratom svojim. """
"Imenovala je Gospoda, ki je z njo govoril: ""Ti si El Roí"";  rekla je namreč: ""Ali sem res tukaj videla tistega,  ki me je videl?"""	"Ona je poklical ime Jehova, ki je govoril z njo, ""Ti si Bog, ki vidi, ""Za ona je rekla, ""Ali sem tudi ostal živ, potem ko ga vidim?"""
Zato se vodnjak imenuje Beêr Laháj Roí;  glej, je med Kadešem in Beredom.	Zato je bil vodnjak imenovan Beer Lahai Roi. Glej, je med Kades in Bered.
Potem je Hagára Abramu rodila sina. Abram je dal sinu, ki ga je rodila Hagára, ime Izmael.	Hagar rodila sina za Abrama. Abram je ime svojega sina, ki Hagar rodila, Izmael.
Ko je Hagára Abramu rodila Izmaela, je bil Abram star šestinosemdeset let.	Abram je bil star šestinosemdeset let, ko je Hagara Abramu rodila Izmaela.
"Ko pa je Abram imel devetindevetdeset let, se mu je prikazal Gospod in mu rekel: ""Jaz sem Bog Mogočni. Hodi pred menoj in bodi popoln!"	Ko je Abram imel devetindevetdeset let, se mu je prikazal GOSPOD in mu rekel:, Jaz sem Bog Mogočni. Hodi pred menoj in bodi brezgrajen.
"Sklenil bom svojo zavezo med seboj in teboj in silno te bom namnožil."""	"svojo zavezo bom sklenil med seboj in teboj in te silno namnožil. """
Abram je padel na obraz in Bog je govoril z njim ter rekel:	Abram je padel na obraz in Bog je govoril z njim, rekoč:
"""Glej, to je moja zaveza s teboj: postal boš oče množice narodov."	"""Kar se mene tiče, glej, moja zaveza je z vami. Ti bo oče množice narodov."
Ne boš se več imenoval Abram,  temveč Abraham  ti bo ime, kajti postavljam te za očeta množici narodov.	Tudi ime tvoje se ne bo več imenovalo Abram, temuč ime tvoje bo Abraham, kajti oče množice narodov, ki sem te naredil.
Naredil te bom silno rodovitnega, napravil bom iz tebe narode in kralji bodo izšli iz tebe.	naredil te bom silno rodovitnega, napravil bom iz tebe narode in kralji bodo izšli iz tebe.
Postavljam svojo zavezo med seboj in teboj ter tvojimi potomci za teboj iz roda v rod kot večno zavezo. Tebi in tvojim potomcem za teboj bom Bog.	postavil bom svojo zavezo med menoj in teboj in tvojim semenom za teboj v njihovih rodovih za večno zavezo, da bom Bog tebi in tvojemu semenu za teboj.
"Tebi in tvojemu potomstvu dajem deželo, v kateri bivaš kot tujec, vso kánaansko deželo, v večno last in bom njihov Bog."""	"tebi in semenu tvojemu za teboj bom dal deželo, po kateri boš potoval, vso deželo Kanaansko, v večno posest in jaz jim bom Bog. """
"Bog je rekel Abrahamu: ""Ti pa se dŕži moje zaveze, ti in tvoji potomci za teboj iz roda v rod!"	"bog je rekel Abrahamu: ""ti pa hraniš mojo zavezo, ti in tvoje seme za teboj po njihovih rodovih."
To je moja zaveza, ki se je držite, zaveza med menoj in vami ter tvojimi potomci za teboj: vsak moški pri vas naj bo obrezan!	To je moja zaveza, ki jo vodi, med menoj in vami in semenom vašim za vami. Vsak moški med vami se obrezan.
Obrežite si meso svojih prednjih kožic! To bodi znamenje zaveze med menoj in vami!	Ti se obrezan v mesu vašega foreskin. To bo znak za zavezo med mano in vami.
Osem dni po rojstvu naj bodo obrezani vsi moški iz roda v rod, najsi bodo rojeni v hiši ali pridobljeni za denar od katerega koli tujca, ki ni izmed tvojih potomcev.	Kdor je star osem dni, bo obrezan med vami, vsak moški v vaših rodovih, tisti, ki je rojen v hiši, ali kupljen z denarjem od kateregakoli tujca, ki ni iz vašega semena.
Oboji morajo biti obrezani, rojeni v tvoji hiši in pridobljeni za tvoj denar. Takó bo moja zaveza v vašem mesu večna zaveza.	Kdor je rojen v hiši tvoji in kdor je kupljen z denarjem tvojim, mora biti obrezan; zaveza moja bode v mesu tvojem za večno zavezo.
"Kar pa zadeva neobrezanega moškega, ki ni obrezan na mesu svoje prednje kožice, naj bo iztrebljen iz svojega ljudstva; prelomil je mojo zavezo."""	"neobrezanega moškega, ki ni obrezan na mesu svoje prednje kožice, ta duša naj bo iztrebljena iz ljudstva njegovega, prelomil je zavezo mojo. """
"Potem je Bog rekel Abrahamu: ""Svoje žene Saráje ne imenuj več Sarája, temveč Sara bodi njeno ime!"	"bog je rekel Abrahamu: ""Sarajo, svojo ženo, pa ne boš klical Saraja, ampak Sara ji bo ime."
"Blagoslovil jo bom in ti dal sina tudi od nje; blagoslovil jo bom, da bodo iz nje nastali narodi in bodo kralji ljudstev izšli iz nje."""	"Jaz jo bom blagoslovil, in poleg tega bom dal sina, ki ga njo. ja, bom jo blagoslovil, in ona bo mati narodov. Kralji ljudstev bo prišel iz nje. """
"Abraham je padel na obraz in se zasmejal. Rekel si je: ""Ali se bo stoletniku rodil sin? Ali bo devetdesetletna Sara rodila?"""	"Potem je Abraham padel na obraz, in se zasmejal, in rekel v svojem srcu, ""Ali se bo sin rodil tistemu, ki je star sto let? Ali bo Sara, ki je stara devetdeset let, rodila?"""
"Abraham je rekel Bogu: ""O da bi le Izmael živel pred teboj!"""	"Abraham je rekel Bogu: ""O da bi Izmael živel pred teboj!"""
"Bog pa je odgovoril: ""Ne, temveč tvoja žena Sara ti bo rodila sina in dal mu boš ime Izak.  Sklenil bom z njim svojo zavezo kot večno zavezo za njegove potomce za njim."	"Bog je rekel: ""ne, ampak Sara, tvoja žena, ti bo rodila sina. boš poklical njegovo ime Izak. Bom vzpostaviti svojo zavezo z njim za večno zavezo za njegovo seme po njem."
Tudi glede Izmaela sem te uslišal; glej, blagoslovil ga bom in ga naredil rodovitnega ter ga silno namnožil; dvanajst knezov se mu bo rodilo in naredil bom iz njega velik narod.	Kot je za Izmaela, Slišal sem te. Evo, Sem ga blagoslovil, in ga bo plodno, in ga bo pomnožite izredno. On bo postal oče dvanajstih knezov, in jaz ga bom velik narod.
"Svojo zavezo pa bom sklenil z Izakom, ki ti ga bo rodila Sara čez leto dni."""	"Toda svojo zavezo sklepam z Izakom, ki ti ga bo rodila Sara ob tem določenem času, naslednje leto. """
Ko je Bog nehal govoriti z njim, se je vzdignil od Abrahama.	Ko je nehal govoriti z njim, je Bog odšel od Abrahama.
Abraham je vzel sina Izmaela, vse, ki so bili rojeni v hiši, in vse, ki so bili pridobljeni za denar, vse moške izmed ljudi Abrahamove hiše, in obrezal meso njihove prednje kožice še isti dan, kakor mu je Bog naročil.	Abraham je vzel Izmaela, svojega sina, vse, ki so se rodili v njegovi hiši, in vse, ki so bili kupljeni s svojim denarjem; in vsakega moškega izmed mož Abrahamove hiše; in obrezal meso njihove kožice istega dne, kakor mu je Bog rekel.
Ko je bil Abraham obrezan na mesu svoje prednje kožice, je bil star devetindevetdeset let,	Abraham je bil star devetindevetdeset let, ko je bil obrezan na mesu svoje prednje kožice.
njegovemu sinu Izmaelu pa je bilo trinajst let, ko je bil obrezan na mesu svoje prednje kožice.	Izmael, njegov sin, je bil star trinajst let, ko je bil obrezan v meso svoje prednje kožice.
Istega dne sta bila obrezana Abraham in njegov sin Izmael.	Istega dne sta bila obrezana Abraham in njegov sin Izmael.
Z njim vred so bili obrezani vsi moški njegove hiše, rojeni v hiši in za denar kupljeni od tujcev.	Z njim so bili obrezani vsi moški v njegovi hiši, tisti, ki so se rodili v hiši, in tisti, ki so jih kupili z denarjem od tujca.
Gospod se je prikazal Abrahamu  pri Mamrejevih hrastih, ko je ob dnevni vročini sedèl pred vhodom v šotor.	Jahve se mu je prikazal pri Mamrejevih hrastih, ko je sedel pri vratih šotora v dnevni vročini.
Povzdignil je oči, pogledal in glej, pred njim so stali trije možje. Ko jih je zagledal, jim je stekel naproti od vhoda v šotor in se jim priklonil do tal.	Povzdignil je oči in pogledal, in videl, da trije moški je stal nasproti njega.Ko jih je videl, je tekel, da jih izpolnjuje od vrat šotora, in se priklonil do tal,
"Rekel je: ""Moj gospod, če sem našel naklonjenost v tvojih očeh, nikar ne hodi mimo svojega služabnika!"	"in rekel: ""moj gospodar, če sem našel milost v tvojih očeh, prosim, ne pojdi stran od svojega služabnika."
Naj prinesejo malo vode, da si umijete noge. Potem se spočijte pod drevesom!	Sedaj pa pustite, da vam prinesejo malo vode, da si umijete noge in počivate pod drevesom.
"Jaz pa prinesem kos kruha, da se okrepčate, potem pa lahko greste naprej. Čemu bi sicer prišli mimo svojega služabnika!"" Rekli so: ""Stori, kakor si rekel!"""	"prinesel ti bom grižljaj kruha, da si boš osvežil srce. potem lahko greš svojo pot, zdaj ko si prišel k svojemu služabniku. ""rekli so:"" prav, stori kakor si rekel. """
"Abraham je pohitel v šotor k Sari in rekel: ""Hitro vzemi tri merice boljše moke, zamesi jo in speci kolače!"""	"Abraham je odhitel v šotor k Sari in rekel: ""Hitro pripravi tri obroke dobrega obroka, ga zgneti in pripravi pecivo."""
Potem je Abraham tekel k živini. Vzel je mlado in lepo tele in ga dal hlapcu; ta ga je hitro pripravil.	Abraham je stekel k čredi in prinesel nežno in dobro tele, ga dal služabniku in pohitel, da bi ga oblekel.
Vzel je masla in mleka ter tele, ki ga je bil pripravil, in vse to položil prednje. Stal je pri njih pod drevesom in so jedli.	Vzel je masla in mleka ter tele, ki ga je pripravil, in vse to položil prednje, in stal je poleg njih pod drevesom, in jedli so.
"Rekli so mu: ""Kje je tvoja žena Sara?"" Rekel je: ""Glejte, v šotoru."""	"Dejali so mu: ""Kje je Sara, tvoja žena? Rekel je:"" Glej, v šotoru. """
"Pa je rekel: ""Čez leto dni se bom vrnil k tebi in glej, tvoja žena Sara bo imela sina."" Sara pa je poslušala za vhodom v šotor, ki je bil za njim."	"Rekel je,, ""Bom zagotovo vrnil k tebi, ko je čas pride krog. Glej, Sara tvoja žena bo imela sina."" Sarah slišal pri vratih šotora, ki je bil za njim."
Abraham in Sara sta bila stara, že zelo v letih; Sari se je nehalo dogajati, kakor se dogaja ženskam,	Abraham in Sara pa sta bila stara, že precej v letih, po ženskem vedenju je prenehala biti pri Sari.
"pa se je sama pri sebi zasmejala in rekla: ""Mar naj zdaj, ko sem uvela, še občutim slast? Tudi moj gospod je star."""	"Sarah se je zasmejala v sebi in rekla: ""ko se postaram, ali bom imela zadovoljstvo, moj gospod pa se bo tudi postaral?"""
"Gospod pa je rekel Abrahamu: ""Zakaj se je Sara zasmejala in rekla: ›Ali bom res rodila, ko sem že ostarela?‹"	"Jehova je rekel Abrahamu: ""zakaj se je Sara smejala, ko je rekla:"" ali bom res rodila otroka, čeprav sem stara? """
"Ali je za Gospoda kaj pretežko? Ko bom čez leto dni v tem času spet prišel k tebi, bo Sara imela sina."""	"Ali je kaj pretežko za GOSPODA? Ob določenem času se bom vrnil k tebi, ko pride čas, in Sara bo imela sina. """
"Sara pa je tajila in rekla: ""Nisem se zasmejala."" Bala se je namreč. ""Pač,"" je rekel, ""zares si se zasmejala."""	"Potem je Sarah zanikala, rekoč, ""Nisem se smejal,"" Za je bila strah.Rekel je, ""Ne, ampak si se smejal."""
Tedaj so se možje odpravili in gledali proti Sódomi, Abraham pa je šel z njimi, da bi jih pospremil.	Možje so vstali in se ozrli proti Sodomi, Abraham pa je šel z njimi, da bi jih videl na poti.
"Gospod si je rekel: ""Ali naj skrivam pred Abrahamom, kaj nameravam storiti?"	"Jehova je rekel: ""ali bom pred Abrahamom skrival, kar počnem,"
Iz Abrahama bo vendar nastal velik in mogočen narod in v njem bodo blagoslovljeni  vsi narodi zemlje.	glede na to, da je iz Abrahama nastal velik in mogočen narod in da bodo v njem blagoslovljeni vsi narodi zemlje,
"Izbral  sem ga, da bo zapovedal svojim sinovom in svoji hiši za njim, naj se držijo Gospodove poti in ravnajo v skladu s pravičnostjo in pravico; tako bo Gospod izpolnil Abrahamu, kar mu je obljubil."""	"Kajti poznam ga, do konca, da bo lahko zapovedal svoje otroke in svojo družino za njim, da se bodo držali poti GOSPODOVE, da bodo delali pravičnost in pravico; do konca, da bo GOSPOD pripeljal nad Abrahama, kar je govoril o njem. """
"Gospod je rekel: ""Vpitje iz Sódome in Gomóre je res silno in njihov greh je izredno težak."	"Jehova je rekel: ""ker je vpitje Sodome in Gomore veliko in ker je njun greh zelo strašen,"
"Stopil bom dol, da vidim, ali so res počeli vse tisto, o čemer govori vpitje, ki prihaja do mene, ali ne. Izvedeti hočem."""	"bom šel zdaj dol, in videli, ali so storili skupaj po krik njega, ki je prišel k meni. Če ne, bom vedel. """
Moža sta se obrnila in odšla proti Sódomi, Abraham pa je še stal pred Gospodom.	Možje so se obrnili in šli proti Sodomi, Abraham pa je še stal pred Jehovom.
"Abraham je pristopil in rekel: ""Ali boš res pokončal pravičnega s krivičnim vred?"	"Abraham se je približal in rekel: ""ali boš pokončal pravične skupaj s krivičnimi?"""
Mogoče je v mestu petdeset pravičnih. Ali boš tudi te pokončal in ne boš prizanesel kraju zaradi petdesetih pravičnih, ki so v njem?	Kaj pa, če je v mestu petdeset pravičnih, ali boste pokončali in ne prizanesli kraju zaradi petdesetih pravičnih, ki so v njem?
"Daleč naj bo od tebe, da bi ti storil kaj takega, da bi pobil pravičnega s krivičnim vred, da bi se enako zgodilo pravičnim kakor krivičnim! Daleč naj bo od tebe! Ali ne bo sodnik vse zemlje ravnal pravično?"""	"To je daleč od tebe, da stvari, kot da bi, ubiti pravičnega z hudobnimi, da bi tako pravični biti kot hudobni. Lahko, da je daleč od vas. Ali ne bi sodnik vse zemlje delati prav? """
"Gospod je rekel: ""Če najdem v Sódomi petdeset pravičnih med meščani, bom prizanesel vsemu kraju zaradi njih."""	"Jehova je rekel: ""Če najdem v Sodomi petdeset pravičnih v mestu, bom prizanesel vsemu kraju zaradi njih."""
"Abraham pa je rekel: ""Glej, jaz, ki sem prah in pepel, sem si dovolil govoriti z Gospodom."	"Abraham je odgovoril, ""Glej, vzel sem si čas, da govorim Gospodu, ki sem prah in pepel."
"Mogoče jih petdesetim pravičnim manjka pet, ali boš zaradi teh petih uničil vse mesto?"" Rekel je: ""Ne bom ga uničil, če jih tam najdem petinštirideset."""	"Kaj pa, če bo pet od petdesetih pravičnih premalo? Ali boste uničili vse mesto zaradi pomanjkanja petih? ""Rekel je:"" Ne bom ga uničil, če jih tam najdem petinštirideset ""."
"Pa je spet spregovoril in mu rekel: ""Mogoče se jih tam najde štirideset."" Odgovoril je: ""Ne bom storil tega zaradi teh štiridesetih."""	"Govoril je z njim še enkrat, in rekel,, ""Kaj pa, če je štirideset našel tam?"" Rekel je, ""Ne bom to naredil zaradi štiridesetih ""."
"Pa je rekel: ""Naj se Gospod ne jezi, če govorim; mogoče se jih tam najde trideset."" Rekel je: ""Ne bom storil tega, če jih najdem trideset."""	"Rekel je, ""Oh ne pustite, da Gospod jezen, in bom govoril. Kaj pa, če obstaja trideset tam našli? ""Rekel je, ""Ne bom to naredil, če najdem trideset tam. """
"Rekel je: ""Glej, dovolil sem si govoriti z Gospodom; mogoče se jih tam najde dvajset."" Rekel je: ""Ne bom jih uničil zaradi teh dvajsetih."""	"Rekel je, ""Glej zdaj, Vzel sem ga na sebi govoriti Gospodu. Kaj pa, če dvajset so tam našli? ""Rekel je, ""Ne bom ga uničil zaradi dvajset 's."""
"Abraham je rekel: ""Naj se Gospod ne jezi, če spregovorim še tokrat: Mogoče se jih tam najde deset."" Odgovoril je: ""Ne bom jih uničil zaradi teh desetih."""	"Rekel je, ""Oh ne pustite, Gospod se jezen, in bom govoril še enkrat, ampak to. Kaj pa, če deset so tam našli?"" Rekel je, ""Ne bom ga uničil zaradi desetih ""."
Gospod je potem, ko je nehal govoriti z Abrahamom, odšel. Abraham pa se je vrnil v svoj kraj.	Jehova je šel svojo pot, kakor hitro je končal pogovor z Abrahamom, in Abraham se je vrnil v svoje mesto.
Zvečer sta angela prišla v Sódomo, ko je Lot sedèl pri sódomskih vratih. Ko ju je zagledal, je vstal, jima šel naproti in se priklonil z obrazom do tal.	In ta dva angela prideta zvečer v Sodomo, in Lot je sedel pri vratih Sodome, in Lot ju je videl, in vstal jima je naproti, in se priklonil z obličjem svojim do tal,
"Rekel je: ""Prosim, gospoda, stopita v hišo svojega služabnika, da prenočita in si umijeta noge, zjutraj pa vstaneta in odideta po svoji poti."" Rekla sta: ""Ne, prenočila bova na trgu."""	"in rekel je: ""poglejte zdaj, moji gospodje, prosim umaknite se v hišo svojega služabnika, ostanite vso noč, umijte si noge in zgodaj boste vstali in odšli."" rekli so: ""ne, ampak bomo ostali na ulici celo noč."""
Zelo ju je silil, zato sta le odšla z njim in stopila v njegovo hišo. Pripravil jima je večerjo, spekel nekvašeni kruh in sta jedla.	On jih je pozval veliko, in so prišli z njim, in je začel v svojo hišo. On jim je praznik, in pečene nekvašenega kruha, in so jedli.
Preden sta legla, so hišo obstopili meščani, sódomski moški, vsi, od dečkov do starcev, vse ljudstvo do zadnjega moža.	Toda preden so legli, so mestni možje, možje iz Sodome, obdali hišo, tako mlado kot staro, in vse ljudi iz vseh koncev.
"Klicali so Lota in mu rekli: ""Kje sta moža, ki sta nocoj prišla k tebi? Pripelji ju ven k nam, da ju spoznamo!"""	"Klicali so Lota in mu rekli: ""Kje sta moška, ki sta nocoj prišla k tebi? Prinesi ju ven k nam, da bomo imeli z njima spolne odnose."""
Lot je tedaj stopil ven k njim na prag, zaprl vrata za seboj	Lot je šel k njim k vratom in za njim zaprl vrata.
"Glejte, imam dve hčeri, ki še nista spoznali moža; naj ju pripeljem k vam, da storite z njima, kar boste hoteli. Samo tema možema ne storite ničesar, saj sta prišla v senco moje strehe!"""	"Glej zdaj, Imam dve deviški hčerki. Prosim, naj jih prinese ven za vas, in vam na njih, kot je dobro v vaših očeh. Samo ne stori ničesar za te ljudi, ker so prišli v senci moje strehe. """
"Rekli so: ""Poberi se!"" Potem so rekli: ""Nekdo je prišel sem kot tujec, pa bi rad razsojal. Tebi bomo storili še kaj hujšega kakor njima."" Silno so pritiskali na Lota in bili na tem, da razbijejo vrata."	"Rekli so,, Stand back ""Rekli so,,"" Ta človek je prišel živeti kot tujec, in on postavlja sam sodnik! Zdaj bomo ravnali slabše z vami, kot z njimi! ""Močno so pritisnili na človeka, celo Lot, in približal, da bi prekinil vrata."
A moža sta iztegnila roke, potegnila Lota k sebi v hišo in zaprla vrata.	Možje pa so iztegnili svojo roko in pripeljali Lota k njim v hišo ter zaprli vrata.
Može pa, ki so stali pri vhodu, sta udarila s slepoto, od najmanjših do največjih, tako da niso mogli najti vrat.	Može, ki so bili pri hišnih vratih, so udarjali s slepoto, tako majhno kot veliko, tako da so se utrudili, da bi našli vrata.
"In moža sta rekla Lotu: ""Imaš v mestu še koga, morda zeta, sinove, hčere ali sicer kakega svojega človeka? Odpelji jih iz kraja!"	"Možje so rekli Lotu: ""Ali imaš tukaj še koga, svojega zeta, svoje sinove, svoje hčere in kogar koli, ki je v mestu, odpelji iz tega kraja!"
"Midva bova namreč ta kraj uničila, kajti njihovo vpitje, ki je prišlo do Gospoda, je prehudo. Zato naju je Gospod poslal, da ga uničiva."""	"ker uničimo ta kraj, ker se je povečal njih krik pred GOSPODOM, in GOSPOD nas je poslal, da ga pokončamo. """
"Lot je šel ven in govoril s svojima zetoma, ki sta nameravala vzeti njegovi hčeri. Rekel je: ""Vstanita, pojdita iz tega kraja, kajti Gospod bo mesto uničil!"" Toda zeta sta mislila, da se šali."	"Lot je šel ven, in govoril s svojimi sinovi-v-zakon, ki so se zavezali, da se poroči svoje hčere, in rekel,, ""Vstani! Pojdi ven iz tega kraja, ker bo Jehova uničil mesto. ""Ampak je zdelo, da njegovi sinovi-v-zakon, da se šali"
"Ko se je vzdignila jutranja zarja, sta angela priganjala Lota in rekla: ""Vstani, vzemi ženo in hčeri, ki sta tu, da ne boš pokončan zaradi krivde tega mesta!"""	"Ko je jutro vstalo, so angeli pohiteli Lota, rekoč, ""Vstani, vzemi ženo svojo in dve hčeri svoji, ki sta tu, da ne boš pokončan v krivici mesta."""
Obotavljal se je, zato sta ga moža zgrabila za roko, prav tako tudi njegovo ženo in hčeri – ker mu je Gospod hotel prizanesti – in ga odpeljala ven ter ga pustila zunaj mesta.	On pa se je obotavljal; in možje so ga držali na roki njegovi in na roki žene njegove in na roki obeh hčera njegovih, GOSPOD mu je bil milosten; in odpeljali so ga ven in ga postavili ven iz mesta.
"Ko sta jih vodila ven, sta rekla: ""Reši si življenje! Ne oziraj se nazaj in ne ustavljaj se nikjer v pokrajini! V gorovje se reši, da ne boš pokončan!"""	"To se je zgodilo, ko so jih odpeljali ven, da je rekel,, ""Pobeg za svoje življenje! Ne poglej za tabo, niti ne ostanejo nikjer v ravnini. Pobegnite na goro, da ne boste porabljeni"""
Glej, tvoj služabnik je našel milost v tvojih očeh in s tem, da si mi rešil življenje, si mi izkazal veliko dobroto. Toda ne morem se rešiti v gore; lahko bi se mi pripetila nesreča in bi umrl.	Glej zdaj, je tvoj služabnik našel milost v tvojih očeh, in ste povečali svojo srčno dobrotljivost, ki ste jih pokazali, da me pri reševanju moje življenje.Ne morem pobegniti na goro, da ne bi zlo me prehiti, in umrem.
"Glej, tisto mesto je dovolj blizu, da se morem zateči vanj. In tako majhno je. Dovôli, da se rešim tja! Ali ni res majhno? Tako bom ostal živ."""	"Poglej zdaj, to mesto je blizu pobegniti v, in to je malo ena. Oh pustite mi pobegniti tam (ni to malo ena?), in moja duša bo živela. """
"Rekel mu je: ""Glej, uslišal ti bom tudi to prošnjo in ne bom razdejal mesta, o katerem si govoril."	"On mu reče:, ""Glej, Sem izpolnil svojo zahtevo glede te stvari tudi, da ne bom strmoglaviti mesto, o katerem ste govorili."
"Hitro se reši tja! Ničesar ne morem storiti, dokler ne prideš tja."" Zato se mesto imenuje Coar."	"Pohiti, pobegni od tam, ker jaz ne morem storiti ničesar, dokler ne prideš tja. ""Zato se je ime tega mesta imenovalo Zoar."
Sonce je vzhajalo nad deželo, ko je Lot prišel do Coarja	Sonce je vzšlo nad zemljo, ko je Lot prišel v Zoar.
in je Gospod storil, da sta od Gospoda, z neba, deževala na Sódomo in Gomóro žveplo in ogenj.	Nato je Jehova zlil dež na Sodomo in Gomoro, žveplo in ogenj z neba.
Razdejal je ti mesti in vso pokrajino, vse prebivalce mest in vse rastlinstvo te dežele.	Razrušil je tista mesta, vso ravnino, vse prebivalce mest in vse tisto, kar je raslo na tleh.
Lotova žena, ki je bila z njim, pa se je ozrla nazaj in postala solnat steber.	Toda njegova žena se je ozrla za njim in postala solnat steber.
Zgodaj zjutraj je šel Abraham na kraj, kjer je bil stal pred Gospodom.	Abraham je zgodaj zjutraj vstal na kraj, kjer je bil stal pred Jehovom.
