Tretji dan je faraon na svoj rojstni dan napravil pojedino vsem svojim služabnikom. Tedaj je sredi svojih služabnikov povzdignil glavo vélikega točaja in glavo vélikega peka.	In zgodilo se je tretji dan, ki je bil faraonov rojstni dan, da je napravil pojedino vsem svojim služabnikom in je povišal glavo velikega točaja in glavo velikega peka med svojimi služabniki.
Vélikega točaja je postavil nazaj v njegovo točajsko službo, da je podajal čašo faraonu v roko.	On je obnovil glavni cupbearer na svojem mestu še enkrat, in je dal skodelico v roke Faraonu;
Vélikega peka pa je dal obesiti, kakor jima je razložil Jožef.	ampak je obesil glavnega peka, kot jim je razložil Jožef.
Toda véliki točaj se ni spomnil na Jožefa, temveč ga je pozabil.	Toda glavni točaj se Jožefa ni spomnil, temveč ga je pozabil.
Ko sta pretekli dve leti, se je faraonu sanjalo: stal je ob Nilu	To se je zgodilo ob koncu dveh polnih let, da Faraon sanjal: in, Evo, je stal ob reki.
in glej, iz Nila je stopilo sedem lepih in rejenih krav in so se pasle v ločju.	Evo, tam je prišel iz reke sedem goveda, dobro voljo in maščobe-olje, in se hranijo v trstičja-trave.
In glej, drugih sedem krav je stopilo iz Nila za njimi. Bile so grde in mršave in postavile so se poleg onih krav na bregu Nila.	Evo, sedem drugih govedo prišel za njimi iz reke, slabo voljo in pusto, in je stal ob drugi živine na robu reke.
Potem so grde in mršave krave požrle sedem lepih in rejenih krav. In faraon se je prebudil.	Slabo in pusto govedo je požrlo sedem najbolj priljubljenih in mastnih goved, zato se je faraon prebudil.
Ko je spet zaspal, se mu je sanjalo drugič. In glej, na enem steblu je rastlo sedem debelih in lepih klasov.	Spal je in sanjal drugič: in, glej, sedem glave žita je prišel na enem steblo, zdrava in dobra.
In glej, za njimi je poganjalo sedem drobnih klasov, ki jih je osmodil vzhodni veter.	Evo, sedem glave žita, tanke in razstrelili z vzhodnim vetrom, vzmetene za njimi.
Drobni klasi so pogoltnili sedem debelih in polnih klasov. Tedaj se je faraon prebudil in glej, bile so sanje.	Tanke žitne glavice so pogoltnile sedem zdravih in polnih uhljev in faraon se je prebudil, in glej, bile so sanje.
Zjutraj je bil njegov duh vznemirjen. Zato je dal poklicati vse egiptovske čarovnike in modrijane. In faraon jim je povedal sanje, a nobeden mu jih ni znal razložiti.	To se je zgodilo zjutraj, da je bil njegov duh vznemirjen, in je poslal in pozval vse čarovniki Egipta, in vsi modreci v njej. Faraon jim je povedal svoje sanje, vendar ni bilo nikogar, ki bi jih razložiti faraonu.
"Tedaj je véliki točaj spregovoril faraonu in rekel: ""Danes sem se spomnil svojih grehov."	"Nato je glavni točaj govoril s faraonom in rekel: ""Danes se spominjam svojih napak."
Faraon se je razjezil na svoja služabnika in ju dal zapreti v hišo načelnika telesne straže, mene in vélikega peka.	Faraon se je razjezil na svoje služabnike in me dal zapreti v hišo načelnika telesne straže, mene in glavnega peka.
Sanjalo pa se je isto noč meni in njemu; vsak je imel svoje sanje, ki so imele zanj poseben pomen.	Mi smo sanjali sanje v eni noči, jaz in on. Smo sanjali vsak človek v skladu z razlago svojih sanj.
Bil pa je tam z nama hebrejski mladenič, suženj načelnika telesne straže. Povedala sva mu sanje in razložil nama jih je; vsakemu je razložil njegove sanje.	Tam je bil z nami je bil mladenič, Hebrew, služabnik kapitana straže, in smo mu povedali, in je razložil, da nam naše sanje. Vsakemu človeku po njegovih sanjah je razlagala.
"In kakor nama je razložil, tako se je zgodilo: jaz sem bil spet postavljen v svojo službo, oni pa je bil obešen."""	"To se je zgodilo, kot je razložil, da nas, tako da je bilo: me je obnovil v moji pisarni, in on ga je obesil. """
Faraon je dal poklicati Jožefa. Hitro so ga pripeljali iz ječe. Obril se je, se preoblekel in prišel k faraonu.	Nato je faraon poslal in poklical Jožefa, in hitro so ga odpeljali iz temnice, se obril, se preoblekel in prišel k faraonu.
"In faraon je rekel Jožefu: ""Imel sem sanje in ni ga, ki bi mi jih razložil. Slišal pa sem o tebi, da kadar slišiš sanje, jih tudi razložiš."""	"Faraon je rekel Jožefu: ""sanjal sem sanje, in ni ga, ki bi jih znal razložiti. slišal sem, da je o tebi rečeno:"" ko slišiš sanje, jih znaš razložiti. """
"Jožef mu je odgovoril in rekel: ""Ne jaz, Bog bo odgovoril faraonu, kar mu je v blagor."""	"Jožef odgovori faraonu in reče: ""to ni v meni, Bog bo dal faraonu odgovor miru."""
"Potem je faraon govoril Jožefu: ""V svojih sanjah, glej, sem stal na bregu Nila."	"Faraon je spregovoril Jožefu, ""V svojih sanjah, glej, sem stal na robu reke."""
In glej, iz Nila je stopilo sedem rejenih in lepih krav in se paslo v ločju.	in, glej, iz reke je prišlo sedem goved, rejenih z mastjo in okuženimi, ki so se hranile s travo iz trstičja.
In glej, za njimi je stopilo iz Nila še sedem drugih, zelo mršavih, zelo grdih in kilavih krav. V vsej egiptovski deželi nisem videl tako grdih krav.	in, glej, sedem drugih živine prišel za njimi, slaba in zelo slabo in pusto-Fleshed, kot nikoli nisem videl v vsej deželi Egiptovski za grdote.
In te kilave in grde krave so požrle sedem rejenih krav.	Vitko in neugoden govedo pojedel prvih sedem maščobe goveda,
Tako so jih požrle, a se jim ni poznalo, da bi jim prišle v trebuh; videti so bile grde kakor prej. Nato sem se prebudil.	in ko so jih pojedli, ni bilo mogoče vedeti, da so jih pojedli, vendar so bili še vedno tako slabo sprejeti, kot na začetku.
In spet sem videl v sanjah: glej, sedem polnih in lepih klasov je rastlo na enem steblu.	videl sem v sanjah, in glej, sedem klasov je prišlo na enem steblu, polnih in dobrih.
In glej, za njimi je poganjalo sedem drugih, suhih, drobnih, ki jih je osmodil vzhodni veter.	in, glej, sedem glave žita, uvela, tanke, in razstrelili z vzhodnim vetrom, vzmetene za njimi.
"In drobni klasi so pogoltnili sedem lepih klasov. To sem povedal čarovnikom, a ni bilo nobenega, ki bi mi znal to razložiti."""	"Tistih zrn glave pogoltnil sedem dobrih klasov žita. To sem povedal na čarovniki; vendar ni bilo nikogar, ki bi ga lahko razloži mi. """
"Jožef je tedaj rekel faraonu: ""Faraonove sanje so le ene. Bog je faraonu naznanil, kaj hoče storiti."	"Jožef pa reče faraonu: ""Sanje Faraonove so eno, in kar bo Bog storil, je naznanil faraonu."
Sedem lepih krav je sedem let in sedem lepih klasov je sedem let; sanje so le ene.	Sedem dobrih goved je sedem let; in sedem dobrih klasov je sedem let; in sanje so eno.
Sedem mršavih in grdih krav, ki so stopale za njimi, je sedem let, in sedem drobnih klasov, ki jih je osmodil vzhodni veter, je sedem let lakote.	Sedem pusto in slabo omejenimi goveda, ki je prišel po njih je sedem let, in tudi sedem praznih glav žita razstrelili z vzhodnim vetrom; bodo sedem let lakote.
To je tisto, kar sem rekel faraonu: Bog je faraonu pokazal, kaj hoče storiti.	To je beseda, ki sem jo govoril faraonu, in to, kar bo storil Bog, je pokazal faraonu.
Prišlo bo sedem let velikega obilja po vsej egiptovski deželi.	In glej, pride sedem let velikega obilja po vsej egiptovski deželi.
Za njimi pa nastopi sedem let lakote in pozabljeno bo vse obilje v egiptovski deželi in lakota bo izčrpala deželo.	In nastopilo bo za njimi sedem let lakote, in pozabilo se bo vse obilje v deželi Egiptovski, in lakota bo opustošila deželo.
Deželi se obilje ne bo poznalo zaradi lakote, ki bo prišla potem; kajti zelo bo pritiskala.	in obilje ne bo znano v deželi zaradi lakote, ki bo prišla za njo, ker bo zelo težka.
Da so se sanje faraonu ponovile, pomeni, da je to Bog trdno sklenil in bo to prav kmalu tudi storil.	Sanje so se podvojile faraonu, ker je stvar ustanovil Bog, in Bog jih bo kmalu uresničil.
Torej naj faraon zdaj poskrbi za razumnega in modrega moža in naj ga postavi nad egiptovsko deželo.	Sedaj pa naj si faraon poišče preudarnega in modrega moža in naj ga postavi nad egiptovsko deželo.
Postavi naj oskrbnike po deželi, da bodo v sedmih letih obilja pobirali petino v egiptovski deželi.	To naj stori faraon, ki naj postavi nadzornike nad deželo, in naj v sedmih letih obilnih dobrin prevzame petino pridelkov dežele Egiptovske.
Naj zberejo ves živež teh dobrih let, ki pridejo, in naj spravijo žito pod faraonovo oblastjo kot živež po mestih in ga shranijo.	Naj zberejo vse hrane v teh dobrih letih, ki prihajajo, in določijo žita pod roko Faraonovo za hrano v mestih, in jim ga hranite.
"Ta živež bo zaloga za deželo za sedem let lakote, ki bo vladala v egiptovski deželi. Tako dežela zaradi lakote ne bo propadla."""	"In ta živež bo v zalogo deželi proti sedmim letom lakote, ki bo v egiptovski deželi; da dežela ne bi poginila zaradi lakote. """
"Faraon je rekel služabnikom: ""Mar bomo našli moža, kakor je ta, ki je v njem Božji duh?"""	"Faraon je rekel svojim služabnikom, ""Ali lahko najdemo takšnega, kot je ta, moža, v katerem je Božji Duh?"""
"Jožefu pa je faraon rekel: ""Potem ko ti je Bog vse to razodel, ni nikogar, ki bi bil tako razumen in moder kakor ti."	"Faraon je rekel Jožefu: ""Ker ti je Bog vse to pokazal, ni nihče tako razumen in moder kakor ti."
"Ti bodi oskrbnik moje hiše in po tvojem ukazu naj se ravna vse moje ljudstvo; samo za prestol bom večji od tebe."""	"Ti bodo nad mojo hišo, in po tvoji besedi bo vladal vse moje ljudstvo. Samo na prestolu bom večji od tebe. """
"Faraon je še rekel Jožefu: ""Glej, postavljam te nad vso egiptovsko deželo."""	"Faraon je rekel Jožefu: ""glej, postavil sem te nad vso deželo Egiptovsko."""
Snel je pečatni prstan in ga dal Jožefu na prst. Oblekel ga je v oblačila iz tankega platna in mu obesil zlato ogrlico okoli vratu.	Faraon je snel svoj pečatni prstan iz njegove roke in ga položil Jožefu na roko in ga oblekel v suknjo iz tenkega platna in mu dal zlato verižico okoli vratu.
"Potem ga je dal peljati na svojem drugem vozu in pred njim so klicali: ""Priklonite se!""  Tako ga je postavil nad vso egiptovsko deželo."	"postavil ga je na drugi voz, ki ga je imel, in pred njim so zavpili: ""Priklonite se!"" postavil ga je nad vso egiptovsko deželo."
"In faraon je rekel Jožefu: ""Jaz sem faraon, a brez tebe naj nihče ne vzdigne ne roke ne noge po vsej egiptovski deželi."""	In reče Faraon Jožefu: Jaz sem Faraon, in brez tebe ne vzdigne nihče roke svoje ali noge svoje po vsej deželi Egiptovski.
In faraon je dal Jožefu ime Cafenát Panéah in mu dal za ženo Asenáto, hčer Potifêra, duhovnika v Onu. Potem je Jožef odšel po egiptovski deželi.	Faraon je poklical Jožefa na ime Zafenat-paneah; in dal mu je za ženo Asenato, hčer Potiferja, svečenika v Onu, in Jožef je šel čez egiptovsko deželo.
Ko je Jožef stopil pred egiptovskega kralja faraona, je imel trideset let. In Jožef je odšel izpred faraonovega obličja in prehodil vso egiptovsko deželo.	Jožef je imel trideset let, ko je stal pred faraonom, kraljem egiptovskim, in je šel Jožef izpred obličja faraona ter je obhodil vso egiptovsko deželo.
Zbral je ves živež sedmih let, ki so nastopila v egiptovski deželi, in ga naložil po mestih; živež s polja okoli vsakega mesta je spravil vanj.	On je zbral vso hrano v sedmih letih, ki so bili v deželi Egiptovski, in iz hrane v mestih: hrana na polju, ki je bila okrogla okoli vsakega mesta, je določeno v isti.
Zbral je žita kakor peska ob morju, silno veliko, tako da je nehal meriti, ker se ni več dalo meriti.	Jožef je kopičil žito kakor pesek ob morju, zelo veliko, dokler ni nehal šteti, kajti bilo ga je brez števila.
Preden je prišlo leto lakote, sta se Jožefu rodila dva sinova, ki mu ju je rodila Asenáta, hči Potifêra, duhovnika v Onu.	Jožefu sta se pred letom lakote rodila dva sinova, ki mu ju je rodila Asenata, hči Potiferja, duhovnika v Onu.
"Jožef je dal prvorojencu ime Manáse, češ: ""Bog mi je dal pozabiti  vse moje trpljenje in vso hišo mojega očeta."""	"Jožef je imenoval prvorojenca Manaseja, ""kajti,"" rekel je, ""Bog mi je dal pozabiti vse težave moje in vso hišo mojega očeta."""
"Drugemu je dal ime Efrájim, češ: ""Bog me je storil rodovitnega  v deželi moje stiske."""	"Ime drugega pa je imenoval Efraim: ""Bog me je namreč naredil rodovitnega v deželi trpljenja mojega."""
In začelo je prihajati sedem let lakote, kakor je napovedal Jožef. Lakota je nastala po vseh deželah, po vsej egiptovski deželi pa je bilo dovolj kruha.	In prišlo je sedem let lakote, kakor je rekel Jožef: lakota je nastala v vseh deželah, po vsej egiptovski deželi pa je bilo kruha.
"Ko je tudi vsa egiptovska dežela trpela lakoto, je ljudstvo vpilo k faraonu za kruh. Faraon pa je rekel vsem Egipčanom: ""Pojdite k Jožefu; kar vam poreče, to storite!"""	"Ko je vsa egiptovska dežela trpela lakoto, je ljudstvo vpilo k faraonu za kruh, in faraon je rekel vsem Egipčanom: ""Pojdite k Jožefu, storite, kar vam reče."""
Ko je po vsej deželi nastopila lakota, je Jožef odprl vse žitnice in prodajal žito Egipčanom. Lakota pa je vedno huje pritiskala po egiptovski deželi.	In lakota je bila po vsej zemlji. In Jožef je odprl vsa skladišča in jih prodal Egipčanom. In lakota je bila huda v deželi Egiptovski.
Ves svet je hodil v Egipt k Jožefu kupovat žito; kajti lakota je hudo pritiskala po vsej zemlji.	Vse dežele so prišle v Egipt k Jožefu, da bi kupile žito, kajti lakota je bila huda po vsej zemlji.
"Ko je Jakob izvedel, da imajo v Egiptu žito, je rekel svojim sinovom: ""Kaj se spogledujete?"""	Jakob pa je videl, da imajo v Egiptu žito, in Jakob reče svojima sinovoma: Zakaj gledata drug drugega?
"In je rekel: ""Slišal sem, da je žito v Egiptu. Pojdite tja in kupite nam žita, da ostanemo pri življenju in ne umremo!"""	"Rekel je, ""Glej, Slišal sem, da je žito v Egiptu. Pojdi tja, in kupiti za nas od tam, tako da bomo lahko živeli, in ne umre."""
Tedaj je odšlo deset Jožefovih bratov, da bi nakupili žita v Egiptu.	Jožefovih deset bratov je šlo kupovat žito iz Egipta.
"Jožefovega brata Benjamina pa Jakob ni poslal z njegovimi brati; rekel si je: ""Da se mu ne pripeti kaka nesreča!"""	"Vendar Jakob ni poslal Jožefovega brata Benjamina s svojimi brati; rekel je namreč: ""da se mu ne zgodi kaj hudega."""
Med drugimi, ki so prihajali kupovat žito, so prišli tudi Izraelovi sinovi, kajti lakota je bila v kánaanski deželi.	In prišli so Izraelovi sinovi kupovat med drugimi, ki so prihajali, kajti lakota je bila v kánaanski deželi.
Jožef je bil oblastnik v deželi in je prodajal žito vsemu ljudstvu. Jožefovi bratje so prišli in se priklonili pred njim z obrazom do tal.	In Jožef je bil deželni oblastnik, on, ki je prodajal vsem ljudstvom dežele; prišli so bratje Jožefovi in se mu klanjali do tal z obrazom svojim.
"Ko jih je Jožef videl, jih je spoznal, a se je delal tujca pred njimi in trdo govoril z njimi. Rekel jim je: ""Od kod ste prišli?"" Rekli so: ""Iz kánaanske dežele kupovat živež."""	"Ko je Jožef videl svoje brate, jih je spoznal, a se jim je obnašal kot tujec in grobo govoril z njimi ter jim rekel: ""Odkod ste prišli?"" Rekli so: ""Iz kanaanske dežele kupiti živeža."""
"Tedaj se je Jožef spomnil sanj, ki jih je imel o njih, in jim je rekel: ""Ogleduhi ste! Prišli ste ogledovat nezavarovane kraje v deželi."""	"ko se je Jožef spomnil sanj, ki jih je imel o njih, jim je rekel: ""vohuni ste, prišli ste ogledovat nagoto dežele."""
"Rekli so mu: ""Ne, moj gospod, tvoji služabniki so prišli nakupit živež."	"Rekli so mu: ""Ne, moj gospod, ampak tvoji služabniki so prišli za nakup hrane."
"Vsi smo sinovi enega moža; pošteni smo, tvoji služabniki niso ogleduhi."""	"Mi vsi smo sinovi enega moža, mi vsi smo pošteni ljudje, hlapci tvoji niso vohuni. """
"""Ne,"" jim je rekel, ""zares ste prišli ogledovat nezavarovane kraje v deželi."""	"Rekel jim je: ""Ne, vi pa ste prišli, da bi videli nagoto dežele."""
"Rekli so: ""Dvanajst je bilo tvojih služabnikov, bratje smo, sinovi enega moža v kánaanski deželi; najmlajši je zdaj pri našem očetu, enega pa ni več."""	"Rekli so:, Mi, tvoji služabniki, dvanajst bratov, sinovi enega moža v deželi Kanaanski; in glej, najmlajši je ta dan z našim očetom, in enega ni več. """
"Jožef pa jim je rekel: ""Tako je, kakor sem vam govoril in rekel: ogleduhi ste!"	"Jožef jim je rekel: ""tako je, kot sem vam rekel, da ste vohuni."""
Takole vas bomo preizkusili: kakor živi faraon, ne boste šli od tod, dokler ne pride sem vaš najmlajši brat.	Od življenja faraona se ne smete oddaljiti od tod, razen če ne pride sem vaš najmlajši brat.
"Pošljite enega izmed sebe, da pripelje vašega brata! Vi pa ostanete ujeti. Tako preizkusimo vaše besede, ali je resnica v njih. Če je ni, kakor živi faraon, ste ogleduhi."""	"Pošlji enega izmed sebe in naj ti pripelje brata, in zvezan boš, da se preizkusijo tvoje besede, ali je resnica v tebi, ali pa po faraonovem življenju zagotovo ste vohuni. """
"Tretji dan jim je rekel: ""To morate storiti, če hočete ostati živi. Bojim se Boga."	"tretji dan jim je Jožef rekel: ""naredite to in živite, kajti bojim se Boga."
Če ste pošteni, naj ostane eden izmed vas ujetnik v hiši, kjer ste bili zaprti. Vi pa pojdite in nesite žito za svoje sestradane hiše;	Če ste pošteni ljudje, nato pa naj eden izmed vaših bratov zvezan v zaporu-house; ampak greš, nosijo žito za lakoto svojih hiš.
"potem pripeljite svojega najmlajšega brata k meni! Tako se bodo vaše besede izkazale za resnične in ne boste umrli."" In storili so tako."	"Pripelji svojega najmlajšega brata k meni, da se tvoje besede izkažejo za resnične in ne boš umrl. ""Storili so tako."
"Govorili so med seboj: ""Resnično, pregrešili smo se nad svojim bratom, saj smo videli stisko njegove duše, ko nas je prosil usmiljenja, pa nismo poslušali; zato je prišla ta stiska nad nas."""	"Rekli so drug drugemu, ""Mi smo najbolj gotovo kriv za našega brata, v tem, da smo videli stisko njegove duše, ko nas je prosil,, in ne bomo poslušali. Zato je ta stiska prišel na nas."""
"Ruben jim je odgovoril in rekel: ""Ali vam nisem rekel: ›Ne pregrešite se nad otrokom!‹ Pa niste hoteli poslušati. Zdaj se od nas terja njegova kri."""	"Reuben jim je odgovoril, rekoč, ""Ali ti nisem povedal, rekoč,"" Ne greši zoper otroka, ""in nisi hotel poslušati? Zato tudi, Evo, njegova kri je potrebno."""
Niso pa vedeli, da Jožef razume, ker je z njimi govoril po tolmaču.	Niso vedeli, da Jožef jih razume; za je bil tolmač med njimi.
Obrnil se je proč od njih in se razjokal. Potem se je vrnil k njim in jim govoril. Vzel je izmed njih Simeona in ga dal zvezati pred njihovimi očmi.	Sam se je obrnil od njih, in jokal, in se je vrnil k njim, in je govoril z njimi, in je Simeona izmed njih, in ga zvezal pred njihovimi očmi.
Potem je ukazal, naj jim napolnijo posode z žitom in jim vrnejo njihov denar, vsakemu v njegovo vrečo, ter jim dajo hrane za na pot. In storili so jim tako.	Tedaj ukaže Jožef, naj napolnijo njih vreče z žitom in naj povrnejo vsak svoj denar v svojo vrečo ter naj jim dajo živeža za pot. Tako se jim je zgodilo.
Na počivališču je eden razvezal svojo vrečo, da bi nakrmil osla. Pa je zagledal svoj denar. Bil je v žitni vreči na vrhu.	Ko je eden od njih odprl vrečo in dal svojemu oslu hrano v prenočišču, je videl svoj denar. Glejte, bil je v žrelu njegove vreče.
"Rekel je bratom: ""Denar mi je bil vrnjen. Tu je, glejte, v moji vreči!"" Srce jim je zastalo in trepetajoč so se obračali drug k drugemu ter rekli: ""Kaj nam je Bog to storil?"""	"Rekel je svojim bratom, ""Moj denar je obnovljena Glej, je tudi v moji vreči."" Njihova srca jih je izneveril!, in so obrnili trepetu drug z drugim, rekoč, ""Kaj je to, da je Bog storil za nas?"""
Potem so prišli k svojemu očetu Jakobu v kánaansko deželo, mu povedali vse, kar se jim je pripetilo, in rekli:	Prišli so k svojemu očetu Jakobu v kánaansko deželo in mu povedali vse, kar se jim je pripetilo, rekoč:
"""Mož, ki je gospodar dežele, je trdo govoril z nami. Imel nas je za ogleduhe dežele."	"""Mož, gospodar dežele, je grobo govoril z nami in nas imel za vohune dežele."
Bilo nas je dvanajst bratov, sinov enega očeta; enega ni več, najmlajši pa je zdaj pri očetu v kánaanski deželi.‹	"Nas je dvanajst bratov, sinov našega očeta; enega ni več, in najmlajši je ta dan pri našem očetu v kanaanski deželi. """
Pa nam je mož, ki je gospodar dežele, rekel: ›Po tem bom spoznal, da ste pošteni: enega svojih bratov pustite pri meni, potem vzemite, kar potrebujete za svoje sestradane hiše in odidite!	"Človek, Gospod dežele, nam je rekel:, ""S tem bom vedel, da ste pošteni ljudje. Pustite enega od svojih bratov z mano, in traja žito za lakoto svojih hiš, in pojdite svojo pot."
"Pripeljite k meni svojega najmlajšega brata in videl bom, da niste ogleduhi, temveč poštenjaki! Vašega brata vam potem vrnem in smeli boste hoditi po deželi.‹"""	"Pripeljite svojega najmlajšega brata k meni. Potem bom vedel, da niste vohuni, ampak da ste pošteni ljudje. Tako bom dal svojega brata k tebi, in jih se v trgovini v deželi. """
Ko so praznili vreče, je vsak našel v svoji vreči mošnjo s svojim denarjem. Ko so sami in njihov oče videli te mošnje, so se prestrašili.	To se je zgodilo, ko so izpraznili svoje vreče, da glej, vsak človek je sveženj denarja v svoji vreči.Ko so in njihov oče videl svoje svežnje denarja, so se bali.
"Oče Jakob jim je rekel: ""Otroke mi jemljete; Jožefa ni več, Simeona ni več in še Benjamina mi jemljete! Vse prihaja nadme!"""	"Jakob, njihov oče, jim je rekel: ""ožaloščeni ste mojih otrok, Jožefa ni več, Simeona ni več in Benjamina hočete odpeljati, vse to je zoper mene."""
"Ruben je rekel očetu: ""Moja sinova usmŕti, če ti ga ne pripeljem nazaj! Zaupaj ga moji roki in vrnil ti ga bom!"""	"Reuben je spregovoril očetu in rekel: ""Ubij moja dva sinova, če ti ga ne pripeljem, mi ga izroči v roke in ti ga pripeljem nazaj."""
"Pa je rekel: ""Moj sin ne pojde z vami. Kajti njegov brat je mrtev in ta je ostal sam. Če bi ga na poti, na katero boste odšli, zadela nesreča, bi spravili moje sive lase z žalostjo v podzemlje."""	On pa reče: Sin moj ne pojde doli s teboj; zakaj brat njegov je mrtev in je edini ostal. Če se mu zgodi nesreča po potu, po katerem hodiš, mi boš z žalostjo spravil sive lase moje v podzemlje.
"Ko so pojedli vse žito, ki so ga prinesli iz Egipta, jim je oče rekel: ""Pojdite in nam spet kupite nekaj živeža!"""	"In zgodi se, ko so pojedli žito, ki so ga bili prinesli iz Egipta, jim je oče rekel:, Pojdite spet, kupite nam malo hrane. """
"Juda mu je rekel: ""Tisti mož nam je ostro zabičal in rekel: ›Ne boste videli mojega obličja, če ne pripeljete s seboj svojega brata.‹"	"Juda govoril z njim, rekoč, ""Človek nas je slovesno opozoril, rekoč,"" Ne boste videli mojega obraza, razen če je tvoj brat z vami. """
Če se odločiš, da pošlješ našega brata z nami, pojdemo in ti kupimo živeža.	Če boš ti poslal našega brata z nami, bomo šli in ti kupili hrano,
"Če ga pa nočeš poslati, ne gremo; kajti mož nam je rekel: ›Ne boste videli mojega obličja, če ne bo vašega brata z vami.‹"""	"če pa ga ne boste poslali, ne bomo šli dol, ker je človek rekel, ""Ne boste videli mojega obraza, razen če je tvoj brat z vami."""
"Izrael je rekel: ""Zakaj ste mi storili to húdo, da ste možu povedali, da imate še enega brata?"""	"Israel je rekel: ""zakaj ste tako grdo ravnali z mano, ko ste možu povedali, da imate še enega brata?"""
"Rekli so: ""Mož nas je natančno spraševal o nas in o naši rodbini: ›Ali vaš oče še živi?‹ je rekel. ›Imate še kakega brata?‹ Morali smo mu odgovoriti na ta vprašanja. Kako bi mogli vedeti, da poreče: ›Pripeljite svojega brata.‹"""	"Rekli so, ""Človek vprašal neposredno o nas, in o naših sorodnikov, rekoč,"" Je tvoj oče še vedno živ? ste še en brat? ""Pravkar smo odgovorili na njegova vprašanja. Ali obstaja način, da bi lahko vedeli, da bi rekel,,"" Bi svojega brata dol? """
"Juda pa je rekel očetu Izraelu: ""Pošlji mladeniča z menoj, da se vzdignemo in odidemo, si ohranimo življenje in ne umremo ne ti ne mi ne naši otroci!"	"Juda je rekel svojemu očetu Izraelu: ""Pošlji dečka z menoj, pa bomo vstali in odšli, da bomo živeli in ne bomo umrli, mi in ti, in tudi naši otroci."
Jaz sem porok zanj. Iz mojih rok ga terjaj! Če ga ne pripeljem nazaj k tebi in ga ne postavim pred tvoje obličje, bom kriv pred teboj vse dni.	bom zavarovanje za njega.\ ~ Iz moje roke ga boste potrebovali.\ ~ Če ga ne bi prinesel k vam, in ga postavil pred vami, potem naj bom kriv za vedno,
"Kajti če ne bi odlašali, bi se zdaj že dvakrat vrnili."""	"kajti če se ne bi zadrževali, bi se zagotovo že drugič vrnili. """
"Nato jim je oče Izrael rekel: ""Če je tako, storite tole: denite najboljše pridelke dežele v svoje posode in nesite možu darilo: nekaj mastike in nekaj medu, kozlinca in ládana, pistacij in mandeljnov!"	"Njihov oče, Izrael, jim je rekel:, ""Če bo tako zdaj, to storite. Vzemite od izbire sadja zemljišča v vaših vrečah, in nosijo navzdol darilo za človeka, malo balzam, malo medu, začimbe in mira, oreški, in mandlji;"
Vzemite s seboj dvakratno vsoto denarja; kajti denar, ki je bil vrnjen na vrhu vaših žitnih vreč, morate nesti nazaj in ga izročiti; nemara se je kdo zmotil.	in vzemite dvojni denar v roko, z denarjem, ki je bil vrnjen v usta vaših vreč, ga ponovno nosite v roki.
